{
  "sender": "tbt",
  "timestamp": "2020-03-23T17:07:33.438Z",
  "id": "f3d9cddc-9f71-b0d6-e634-2010ccfc800a",
  "payer_phone": "380837038206",
  "user_id": "ABCDEFGHIJKLMNOPQRSTU",
  "dest": "wallet",
  "posop": "fcs_term",
  "posorder_id": "ABCDEF",
  "merchant_id": "ABCDEFGHIJKLMNOPQRSTUVWX",
  "amount": "3.90",
  "comment": "ABCDEFGHIJKLMNOPQRSTU"
}
